{
  "task_id": "auth-001",
  "acceptance_id": "acc-auth-001-001",
  "acceptance_timestamp": "2026-07-19T13:30:00Z",
  "decision": "accepted",
  "verifier": "main-agent-beta",
  "original_task": {
    "task_id": "auth-001",
    "smart_definition": {
      "specific": "Implement JWT-based user authentication with login, logout, and token refresh endpoints",
      "measurable": "Auth middleware handles 100% of protected routes, login/logout work end-to-end, token refresh prevents session expiry, all tests pass with >90% coverage",
      "achievable": "Using existing Express framework, JWT library already in dependencies, user model exists in src/models/user.ts",
      "relevant": "Required for all user-facing features, blocks profile and settings implementation, security foundation for the application",
      "time_bound": "Complete within 2 hours, tests must pass before submission"
    }
  },
  "verification_results": {
    "specific": {
      "passed": true,
      "evidence": "All requested functionality implemented: login endpoint, logout endpoint, refresh endpoint, and auth middleware. No scope creep detected.",
      "issues": []
    },
    "measurable": {
      "passed": true,
      "evidence": "All 3 deliverables present. Tests: 15/15 passing. Coverage: 92.3% (>90% required). Build succeeds.",
      "issues": []
    },
    "achievable": {
      "passed": true,
      "evidence": "Solution uses existing Express framework and JWT library as specified. Code is clean, follows conventions, and is maintainable.",
      "issues": []
    },
    "relevant": {
      "passed": true,
      "evidence": "Authentication foundation for the application. Follows architectural patterns. No conflicts with existing code.",
      "issues": []
    },
    "time_bound": {
      "passed": true,
      "evidence": "Completed in 1.5 hours (under 2-hour limit). All verification commands passed.",
      "issues": []
    }
  },
  "acceptance_criteria": [
    {
      "criterion": "POST /api/auth/login returns JWT token on valid credentials",
      "met": true,
      "evidence": "Verified: POST /api/auth/login with valid credentials returns 200 with access_token and refresh_token"
    },
    {
      "criterion": "POST /api/auth/logout invalidates refresh token",
      "met": true,
      "evidence": "Verified: After logout, refresh token is blacklisted and cannot be reused"
    },
    {
      "criterion": "GET /api/auth/refresh generates new access token",
      "met": true,
      "evidence": "Verified: Valid refresh token returns new access_token, old token still works until expiry"
    },
    {
      "criterion": "Protected routes return 401 without valid token",
      "met": true,
      "evidence": "Verified: GET /api/protected returns 401 when Authorization header is missing"
    },
    {
      "criterion": "All tests pass with >90% coverage",
      "met": true,
      "evidence": "Verified: npm test shows 15/15 passing, coverage report shows 92.3%"
    }
  ],
  "overall_score": 98,
  "decision_rationale": "All acceptance criteria met. Implementation is clean, well-tested, and follows project conventions. Ready for integration.",
  "conditions": [],
  "feedback": [
    {
      "type": "praise",
      "message": "Excellent implementation. All endpoints work as expected with proper error handling."
    },
    {
      "type": "praise",
      "message": "Tests are comprehensive and cover edge cases well."
    },
    {
      "type": "improvement",
      "message": "Consider adding rate limiting to login endpoint for production use."
    }
  ],
  "verification_evidence": [
    {
      "type": "command_output",
      "description": "Running all tests",
      "path": "npm test",
      "content": "PASS src/routes/auth.test.ts\n  15 tests passed\n\nTest Suites: 1 passed, 1 total\nTests:       15 passed, 15 total"
    },
    {
      "type": "command_output",
      "description": "Type checking",
      "path": "npm run typecheck",
      "content": "No errors found."
    },
    {
      "type": "command_output",
      "description": "Linting",
      "path": "npm run lint",
      "content": "No lint errors found."
    },
    {
      "type": "command_output",
      "description": "Build verification",
      "path": "npm run build",
      "content": "Build successful."
    }
  ],
  "next_steps": [
    "Integrate auth middleware into protected routes",
    "Update API documentation with new endpoints",
    "Deploy to staging environment for testing"
  ],
  "self_check_comparison": {
    "self_check_score": 95,
    "acceptance_score": 98,
    "variance": 3,
    "assessment": "accurate"
  }
}